{
  "$schema": "../../../studio-os/contracts/comic-review.schema.json",
  "issue": "issue-001",
  "decision": "changes_requested",
  "master_sha256": "0bcd58ee9311087d28972268fe168de7dd377935e9325cb2547bb13eaf0e7dbd",
  "reviewer_role": "showrunner",
  "decided_at": "2026-08-09T18:36:20.429241+00:00",
  "source": "telegram_editorial_chat",
  "comment": "вобще фигня какая-то, давй сначала идеи утверждать, потом картинки кидать"
}
